headline,content,summary,sentiment,link,source,publication_date
Natixis Advisors LLC Increases Stock Position in Deutsche Bank Aktiengesellschaft (NYSE:DB),"Acadian Asset Management LLC trimmed its position in Deutsche Bank Aktiengesellschaft (NYSE:DB - Free Report) by 32.4% during the second quarter, according to the company in its most recent 13F filing with the SEC. The firm owned 10,864,919 shares of the bank's stock after selling 5,205,036 shares during the quarter. Acadian Asset Management LLC owned approximately 0.53% of Deutsche Bank Aktiengesellschaft worth $173,562,000 as of its most recent SEC filing. 

Other hedge funds have also bought and sold shares of the company. Natixis Advisors L.P. raised its holdings in Deutsche Bank Aktiengesellschaft by 13.5% in the 4th quarter. Natixis Advisors L.P. now owns 238,966 shares of the bank's stock valued at $3,237,000 after acquiring an additional 28,387 shares during the period. M&T Bank Corp acquired a new stake in Deutsche Bank Aktiengesellschaft during the 4th quarter worth approximately $148,000. BNP Paribas Financial Markets boosted its position in shares of Deutsche Bank Aktiengesellschaft by 109.3% in the fourth quarter. BNP Paribas Financial Markets now owns 247,971 shares of the bank's stock valued at $3,360,000 after acquiring an additional 129,488 shares during the period. QRG Capital Management Inc. grew its position in shares of Deutsche Bank Aktiengesellschaft by 14.0% during the 4th quarter. QRG Capital Management Inc. now owns 240,139 shares of the bank's stock worth $3,254,000 after purchasing an additional 29,399 shares in the last quarter. Finally, Forum Financial Management LP increased its stake in Deutsche Bank Aktiengesellschaft by 13.4% during the 4th quarter. Forum Financial Management LP now owns 90,645 shares of the bank's stock worth $1,228,000 after acquiring an additional 10,717 shares during the period. 27.90% of the stock is currently owned by institutional investors and hedge funds. 

DB has been the subject of a number of analyst reports. StockNews.com downgraded Deutsche Bank Aktiengesellschaft from a ""buy"" rating to a ""hold"" rating in a research note on Friday, July 26th. Barclays raised shares of Deutsche Bank Aktiengesellschaft from an ""equal weight"" rating to an ""overweight"" rating in a report on Tuesday, September 3rd. Three equities research analysts have rated the stock with a hold rating and two have issued a buy rating to the stock. Based on data from MarketBeat, the stock has an average rating of ""Hold"".

Read Our Latest Stock Analysis on Deutsche Bank Aktiengesellschaft

Deutsche Bank Aktiengesellschaft stock traded down $0.45 during mid-day trading on Friday, reaching $16.16. The company had a trading volume of 1,927,071 shares, compared to its average volume of 2,535,550. The business has a fifty day simple moving average of $15.90 and a 200 day simple moving average of $15.83. The company has a market cap of $33.40 billion, a P/E ratio of 7.06, a P/E/G ratio of 2.58 and a beta of 1.21. Deutsche Bank Aktiengesellschaft has a fifty-two week low of $10.00 and a fifty-two week high of $17.95. The company has a current ratio of 0.78, a quick ratio of 0.78 and a debt-to-equity ratio of 1.43. 

Deutsche Bank Aktiengesellschaft (NYSE:DB - Get Free Report) last released its quarterly earnings results on Wednesday, July 24th. The bank reported ($0.41) earnings per share for the quarter, missing the consensus estimate of $0.49 by ($0.90). Deutsche Bank Aktiengesellschaft had a return on equity of 4.63% and a net margin of 5.58%. The firm had revenue of $7.87 billion for the quarter, compared to the consensus estimate of $8.18 billion. On average, equities research analysts predict that Deutsche Bank Aktiengesellschaft will post 2.29 earnings per share for the current year. 

Deutsche Bank Aktiengesellschaft, a stock corporation, provides corporate and investment banking, and asset management products and services to private individuals, corporate entities, and institutional clients in Germany, the United Kingdom, rest of Europe, the Middle East, Africa, the Americas, and the Asia-Pacific.Featured StoriesFive stocks we like better than Deutsche Bank AktiengesellschaftWhat Are Dividend Champions? How to Invest in the ChampionsGE Vernova's Rally Could Continue as Wind Business Gains GroundHow Can Investors Benefit From After-Hours TradingDraftKings vs. DoubleDown: Growth in the Online Gambling BoomHow to Read Stock Charts for BeginnersJoin UiPath’s AI Surge and Catch the Coming Stock Price Reversal→ War on Elon Escalates…  (From Porter & Company) (Ad)Should you invest $1,000 in Deutsche Bank Aktiengesellschaft right now?Before you consider Deutsche Bank Aktiengesellschaft, you'll want to hear this.MarketBeat keeps track of Wall Street's top-rated and best performing research analysts and the stocks they recommend to their clients on a daily basis. MarketBeat has identified the five stocks that top analysts are quietly whispering to their clients to buy now before the broader market catches on... and Deutsche Bank Aktiengesellschaft wasn't on the list.While Deutsche Bank Aktiengesellschaft currently has a ""Moderate Buy"" rating among analysts, top-rated analysts believe these five stocks are better buys.View The Five Stocks Here Beginner's Guide to Pot Stock InvestingClick the link below and we'll send you MarketBeat's guide to pot stock investing and which pot companies show the most promise. Get This Free Report




Before you consider Deutsche Bank Aktiengesellschaft, you'll want to hear this.

MarketBeat keeps track of Wall Street's top-rated and best performing research analysts and the stocks they recommend to their clients on a daily basis. MarketBeat has identified the five stocks that top analysts are quietly whispering to their clients to buy now before the broader market catches on... and Deutsche Bank Aktiengesellschaft wasn't on the list.

While Deutsche Bank Aktiengesellschaft currently has a ""Moderate Buy"" rating among analysts, top-rated analysts believe these five stocks are better buys.

View The Five Stocks Here 

Click the link below and we'll send you MarketBeat's guide to pot stock investing and which pot companies show the most promise. 

Sign up for MarketBeat All Access to gain access to MarketBeat's full suite of research tools.

Featured By


345 N Reid Place, Suite 620, Sioux Falls, SD 57103

contact@marketbeat.com

(844) 978-6257


© MarketBeat Media, LLC® 2010-2024. All rights reserved.


© 2024 Market data provided is at least 10-minutes delayed and hosted by Barchart Solutions. Information is provided 'as-is' and solely for informational purposes, not for trading purposes or advice, and is delayed. To see all exchange delays and terms of use please see Barchart's disclaimer. 


My Account - 
","Natixis Advisors LLC lifted its position in shares of Deutsche Bank 
Aktiengesellschaft (NYSE:DB - Free Report) by 41.5% during the second 
quarter,...",,https://www.marketbeat.com/instant-alerts/nyse-db-sec-filing-2024-09-08/,MarketBeat,2024-09-08 18:09:25.303394
